{"walls":[{"id":"w01","thickness":200.0,"z0":0.0,"z1":3000.0,"rings":[[[6486.7,14230.0],[6286.7,14230.0],[6286.7,14430.0],[6286.7,26530.0],[6286.7,26730.0],[6486.7,26730.0],[26330.0,26730.0],[26530.0,26730.0],[36330.0,26730.0],[36530.0,26730.0],[36530.0,26530.0],[36530.0,9400.0],[36530.0,9200.0],[36530.0,4420.0],[36530.0,4220.0],[36330.0,4220.0],[26740.0,4220.0],[26540.0,4220.0],[26540.0,4420.0],[26540.0,16715.0],[11474.8,16715.0],[11474.8,14430.0],[11474.8,14230.0],[11274.8,14230.0]],[[32230.0,14416.2],[36330.0,14416.2],[36330.0,16721.9],[32230.0,16721.9]],[[32230.0,16946.9],[36330.0,16946.9],[36330.0,21050.0],[31541.8,21050.0],[31541.8,16946.9],[32130.0,16946.9],[32180.0,16946.9]],[[11274.8,19940.0],[9960.0,19940.0],[9960.0,18840.0],[11274.8,18840.0]],[[11474.8,21045.0],[11474.8,16940.0],[13784.3,16940.0],[13784.3,21045.0]],[[8950.0,18740.0],[8950.0,16940.0],[11274.8,16940.0],[11274.8,18740.0]],[[11274.8,14430.0],[11274.8,16715.0],[8950.0,16715.0],[8750.0,16715.0],[8750.0,16940.0],[8750.0,18740.0],[8750.0,18748.6],[8750.0,18840.0],[9860.0,18840.0],[9860.0,19940.0],[9860.0,20040.0],[9960.0,20040.0],[11274.8,20040.0],[11274.8,22341.1],[8961.4,22341.1],[8961.4,22432.5],[8770.0,22432.5],[8770.0,22940.0],[6486.7,22940.0],[6486.7,14430.0]],[[26740.0,11910.0],[27950.0,11910.0],[27950.0,11710.0],[26740.0,11710.0],[26740.0,9400.0],[27950.0,9400.0],[27950.0,9200.0],[26740.0,9200.0],[26740.0,6883.9],[27950.0,6883.9],[27950.0,6683.9],[26740.0,6683.9],[26740.0,4420.0],[36330.0,4420.0],[36330.0,6690.0],[35150.3,6690.0],[35150.3,6890.0],[36330.0,6890.0],[36330.0,9200.0],[35150.3,9200.0],[35150.3,9400.0],[36330.0,9400.0],[36330.0,11700.0],[35150.3,11700.0],[35150.3,11900.0],[36330.0,11900.0],[36330.0,14216.2],[26740.0,14216.2]],[[29963.2,16940.0],[29963.2,16715.0],[26740.0,16715.0],[26740.0,14416.2],[32130.0,14416.2],[32130.0,16796.9],[31491.8,16796.9],[31491.8,16827.5],[31441.8,16827.5],[31441.8,21050.0],[31441.8,21150.0],[31541.8,21150.0],[36330.0,21150.0],[36330.0,26530.0],[34050.0,26530.0],[34050.0,25330.6],[33850.0,25330.6],[33850.0,26530.0],[31548.5,26530.0],[31548.5,25330.6],[31348.5,25330.6],[31348.5,26530.0],[29040.0,26530.0],[29040.0,25330.6],[28840.0,25330.6],[28840.0,26530.0],[26530.0,26530.0],[26530.0,25330.6],[26330.0,25330.6],[26330.0,26530.0],[24020.0,26530.0],[24020.0,25330.6],[23820.0,25330.6],[23820.0,26530.0],[21509.5,26530.0],[21509.5,21138.1],[28941.5,21138.1],[28941.5,21038.1],[28135.0,21038.1],[28135.0,16940.0]],[[26530.0,18359.4],[26530.0,16940.0],[27985.0,16940.0],[27985.0,18350.5]],[[26530.0,18459.4],[27985.0,18450.5],[27985.0,19740.0],[26530.0,19740.0]],[[26530.0,19840.0],[27985.0,19840.0],[27985.0,21038.1],[26530.0,21038.1]],[[26330.0,16940.0],[26330.0,21038.1],[24020.0,21038.1],[24020.0,16940.0]],[[23820.0,16940.0],[23820.0,21038.1],[21509.5,21038.1],[21509.5,16940.0]],[[11474.8,21145.0],[13792.9,21145.0],[13792.9,21053.6],[13984.3,21053.6],[13984.3,16940.0],[16290.0,16940.0],[16290.0,18137.6],[16490.0,18137.6],[16490.0,16940.0],[18801.7,16940.0],[18801.7,18137.6],[19001.7,18137.6],[19001.7,16940.0],[21309.5,16940.0],[21309.5,26530.0],[18990.0,26530.0],[18990.0,25330.6],[18790.0,25330.6],[18790.0,26530.0],[16490.0,26530.0],[16490.0,25330.6],[16290.0,25330.6],[16290.0,26530.0],[13977.4,26530.0],[13977.4,25330.6],[13777.4,25330.6],[13777.4,26530.0],[11474.8,26530.0]],[[6486.7,23040.0],[8778.6,23040.0],[8778.6,22948.6],[8970.0,22948.6],[8970.0,22441.1],[11274.8,22441.1],[11274.8,26530.0],[6486.7,26530.0]]]}],"openings":[{"id":"window-64","host_id":"w01","kind":"window","width":920.0,"center":[7253.5,26630.0],"sill":900.0,"head":2100.0},{"id":"door-01","host_id":"w01","kind":"door","width":900.0,"center":[8850.0,17500.0],"sill":0.0,"head":2100.0},{"id":"door-02","host_id":"w01","kind":"door","width":900.0,"center":[9530.0,22391.1],"sill":0.0,"head":2100.0},{"id":"door-03","host_id":"w01","kind":"door","width":850.0,"center":[9910.0,19360.0],"sill":0.0,"head":2100.0},{"id":"door-04","host_id":"w01","kind":"door","width":1050.0,"center":[11374.8,21740.0],"sill":0.0,"head":2100.0},{"id":"door-05","host_id":"w01","kind":"door","width":1000.0,"center":[12390.0,16827.5],"sill":0.0,"head":2100.0},{"id":"door-06","host_id":"w01","kind":"door","width":900.0,"center":[13260.0,21095.0],"sill":0.0,"head":2100.0},{"id":"door-07","host_id":"w01","kind":"door","width":900.0,"center":[23250.0,21088.1],"sill":0.0,"head":2100.0},{"id":"door-08","host_id":"w01","kind":"door","width":950.0,"center":[24670.0,21088.1],"sill":0.0,"head":2100.0},{"id":"door-09","host_id":"w01","kind":"door","width":800.0,"center":[28060.0,17690.0],"sill":0.0,"head":2100.0},{"id":"door-10","host_id":"w01","kind":"door","width":800.0,"center":[28060.0,18980.0],"sill":0.0,"head":2100.0},{"id":"door-11","host_id":"w01","kind":"door","width":850.0,"center":[28060.0,20590.0],"sill":0.0,"head":2100.0},{"id":"door-12","host_id":"w01","kind":"door","width":900.0,"center":[31520.0,4320.0],"sill":0.0,"head":2100.0},{"id":"door-13","host_id":"w01","kind":"door","width":900.0,"center":[31491.8,20440.0],"sill":0.0,"head":2100.0},{"id":"door-14","host_id":"w01","kind":"door","width":950.0,"center":[32180.0,16200.0],"sill":0.0,"head":2100.0},{"id":"window-02","host_id":"w01","kind":"window","width":960.0,"center":[6386.7,25340.0],"sill":900.0,"head":2100.0},{"id":"window-04","host_id":"w01","kind":"window","width":430.0,"center":[7620.0,14330.0],"sill":900.0,"head":2100.0},{"id":"window-06","host_id":"w01","kind":"window","width":940.0,"center":[9580.0,26630.0],"sill":900.0,"head":2100.0},{"id":"window-07","host_id":"w01","kind":"window","width":930.0,"center":[10680.0,26630.0],"sill":900.0,"head":2100.0},{"id":"window-08","host_id":"w01","kind":"window","width":960.0,"center":[11374.8,15310.0],"sill":900.0,"head":2100.0},{"id":"window-09","host_id":"w01","kind":"window","width":940.0,"center":[12100.0,26630.0],"sill":900.0,"head":2100.0},{"id":"window-10","host_id":"w01","kind":"window","width":930.0,"center":[13220.0,26630.0],"sill":900.0,"head":2100.0},{"id":"window-11","host_id":"w01","kind":"window","width":900.0,"center":[14590.0,16827.5],"sill":900.0,"head":2100.0},{"id":"window-12","host_id":"w01","kind":"window","width":900.0,"center":[14590.0,26630.0],"sill":900.0,"head":2100.0},{"id":"window-13","host_id":"w01","kind":"window","width":970.0,"center":[15680.0,16827.5],"sill":900.0,"head":2100.0},{"id":"window-14","host_id":"w01","kind":"window","width":950.0,"center":[15680.0,26630.0],"sill":900.0,"head":2100.0},{"id":"window-15","host_id":"w01","kind":"window","width":950.0,"center":[17080.0,16827.5],"sill":900.0,"head":2100.0},{"id":"window-16","host_id":"w01","kind":"window","width":950.0,"center":[17100.0,26630.0],"sill":900.0,"head":2100.0},{"id":"window-17","host_id":"w01","kind":"window","width":950.0,"center":[18200.0,16827.5],"sill":900.0,"head":2100.0},{"id":"window-18","host_id":"w01","kind":"window","width":960.0,"center":[18210.0,26630.0],"sill":900.0,"head":2100.0},{"id":"window-19","host_id":"w01","kind":"window","width":960.0,"center":[19600.0,16827.5],"sill":900.0,"head":2100.0},{"id":"window-20","host_id":"w01","kind":"window","width":960.0,"center":[19620.0,26630.0],"sill":900.0,"head":2100.0},{"id":"window-21","host_id":"w01","kind":"window","width":950.0,"center":[20700.0,16827.5],"sill":900.0,"head":2100.0},{"id":"window-22","host_id":"w01","kind":"window","width":930.0,"center":[20720.0,26630.0],"sill":900.0,"head":2100.0},{"id":"window-23","host_id":"w01","kind":"window","width":1000.0,"center":[21409.5,21730.0],"sill":900.0,"head":2100.0},{"id":"window-24","host_id":"w01","kind":"window","width":960.0,"center":[22110.0,16827.5],"sill":900.0,"head":2100.0},{"id":"window-25","host_id":"w01","kind":"window","width":940.0,"center":[22130.0,26630.0],"sill":900.0,"head":2100.0},{"id":"window-26","host_id":"w01","kind":"window","width":970.0,"center":[23220.0,16827.5],"sill":900.0,"head":2100.0},{"id":"window-27","host_id":"w01","kind":"window","width":950.0,"center":[23240.0,26630.0],"sill":900.0,"head":2100.0},{"id":"window-28","host_id":"w01","kind":"window","width":860.0,"center":[24590.0,16827.5],"sill":900.0,"head":2100.0},{"id":"window-29","host_id":"w01","kind":"window","width":910.0,"center":[24620.0,26630.0],"sill":900.0,"head":2100.0},{"id":"window-30","host_id":"w01","kind":"window","width":920.0,"center":[25700.0,16827.5],"sill":900.0,"head":2100.0},{"id":"window-31","host_id":"w01","kind":"window","width":930.0,"center":[25720.0,26630.0],"sill":900.0,"head":2100.0},{"id":"window-32","host_id":"w01","kind":"window","width":960.0,"center":[26640.0,4990.0],"sill":900.0,"head":2100.0},{"id":"window-33","host_id":"w01","kind":"window","width":950.0,"center":[26640.0,6080.0],"sill":900.0,"head":2100.0},{"id":"window-34","host_id":"w01","kind":"window","width":920.0,"center":[26640.0,7470.0],"sill":900.0,"head":2100.0},{"id":"window-35","host_id":"w01","kind":"window","width":930.0,"center":[26640.0,8580.0],"sill":900.0,"head":2100.0},{"id":"window-36","host_id":"w01","kind":"window","width":960.0,"center":[26640.0,9980.0],"sill":900.0,"head":2100.0},{"id":"window-37","host_id":"w01","kind":"window","width":940.0,"center":[26640.0,11080.0],"sill":900.0,"head":2100.0},{"id":"window-38","host_id":"w01","kind":"window","width":960.0,"center":[26640.0,12500.0],"sill":900.0,"head":2100.0},{"id":"window-39","host_id":"w01","kind":"window","width":930.0,"center":[26640.0,13600.0],"sill":900.0,"head":2100.0},{"id":"window-40","host_id":"w01","kind":"window","width":950.0,"center":[26640.0,15020.0],"sill":900.0,"head":2100.0},{"id":"window-41","host_id":"w01","kind":"window","width":930.0,"center":[26640.0,16120.0],"sill":900.0,"head":2100.0},{"id":"window-42","host_id":"w01","kind":"window","width":930.0,"center":[27140.0,26630.0],"sill":900.0,"head":2100.0},{"id":"window-43","host_id":"w01","kind":"window","width":920.0,"center":[28240.0,26630.0],"sill":900.0,"head":2100.0},{"id":"window-44","host_id":"w01","kind":"window","w